{
  "schema": "seqcraft.logicblock",
  "version": "0.1",
  "units": "SI",
  "opts": {
    "max_b1_hz": 1000.0,
    "max_grad_hz_per_m": 1703040.0,
    "max_slew_hz_per_m_per_s": 6386400000.0,
    "max_frequency_offset_hz": 250000.0,
    "rf_dead_time_s": "0.0001",
    "rf_ringdown_time_s": "0.00003",
    "adc_dead_time_s": "0.00001",
    "adc_raster_time_s": "0.0000001",
    "rf_raster_time_s": "0.000001",
    "grad_raster_time_s": "0.00001",
    "block_duration_raster_s": "0.00001",
    "adc_samples_limit": 0,
    "rf_samples_limit": 0,
    "adc_samples_divisor": 4,
    "trigger_identifier_supported": true,
    "gamma_hz_per_t": 42576000.0,
    "b0_t": 3.0
  },
  "definitions": {"FOV": [0.22, 0.22, 0.005]},
  "root": {
    "tag": "minimal",
    "nodes": [
      {
        "start_s": "0",
        "item": {
          "kind": "event",
          "event_type": "delay",
          "payload": {"duration_s": "0.001"}
        }
      },
      {
        "start_s": "0.001",
        "item": {
          "kind": "block",
          "block": {
            "tag": "readout",
            "nodes": [
              {
                "start_s": "0",
                "item": {
                  "kind": "event",
                  "event_type": "trap",
                  "payload": {
                    "channel": "x",
                    "amplitude_hz_per_m": 100000.0,
                    "rise_time_s": "0.0001",
                    "flat_time_s": "0.0008",
                    "fall_time_s": "0.0001",
                    "area_per_m": 90.0,
                    "flat_area_per_m": 80.0,
                    "delay_s": "0",
                    "first_hz_per_m": 0.0,
                    "last_hz_per_m": 0.0
                  }
                }
              }
            ]
          }
        }
      }
    ]
  },
  "provenance": {
    "producer": "handwritten-fixture",
    "producer_version": "0.1",
    "metadata": {"purpose": "minimum nested-tree schema fixture"}
  }
}
